{
  "$schema": "http://json-schema.org/draft-07/schema#",
  "$id": "https://lifegames.org/schemas/copy.permissions.schema.json",
  "title": "LifegamesCopyPermissions",
  "description": "Rich authoring schema for the permissions slice of @j0nathan-ll0yd/copy. Every Info.plist privacy-usage-description string the iOS app and watch present at permission-request time, keyed per-target: the app and watch targets intentionally use different wording (the watch omits app-only context). Each leaf is a CopyString carrying authoring context in _meta. Source of truth is ios-LifegamesPortal/LifePortal/project.yml (the NS*UsageDescription Info.plist properties on the LifePortal app target and the LifePortalWatch target). The copy build derives a FLAT schema from this one (stripping _meta) for all consumer codegen (TS/Zod/Swift). Strings are authored in ICU MessageFormat 1 syntax (static passthrough — no interpolation here). Stored in natural case. The $defs block is byte-identical to schema/identity.schema.json, schema/widgets.schema.json, and schema/a11y.schema.json; the $defs are inlined per schema file (no cross-file $ref), which the flat-schema derivation requires.",
  "type": "object",
  "additionalProperties": false,
  "required": ["health", "locationWhenInUse", "locationAlways", "motion"],
  "properties": {
    "health": {
      "type": "object",
      "title": "PermHealth",
      "description": "NSHealthShareUsageDescription — shown when the app/watch requests HealthKit read access. The app variant adds 'to display metrics'; the watch variant only syncs.",
      "additionalProperties": false,
      "required": ["app", "watch"],
      "properties": {
        "app": {
          "$ref": "#/$defs/CopyString"
        },
        "watch": {
          "$ref": "#/$defs/CopyString"
        }
      }
    },
    "locationWhenInUse": {
      "type": "object",
      "title": "PermLocation",
      "description": "NSLocationWhenInUseUsageDescription — shown when the app/watch requests foreground location access. The app variant tracks movement history; the watch variant only displays current position.",
      "additionalProperties": false,
      "required": ["app", "watch"],
      "properties": {
        "app": {
          "$ref": "#/$defs/CopyString"
        },
        "watch": {
          "$ref": "#/$defs/CopyString"
        }
      }
    },
    "locationAlways": {
      "type": "object",
      "title": "PermLocationAlways",
      "description": "NSLocationAlwaysAndWhenInUseUsageDescription — shown when the app requests background ('always') location access. App-only: the watch target has no always-on location usage description.",
      "additionalProperties": false,
      "required": ["app"],
      "properties": {
        "app": {
          "$ref": "#/$defs/CopyString"
        }
      }
    },
    "motion": {
      "type": "object",
      "title": "PermMotion",
      "description": "NSMotionUsageDescription — shown when the app requests Core Motion access for arrival/departure detection. App-only: the watch target has no motion usage description.",
      "additionalProperties": false,
      "required": ["app"],
      "properties": {
        "app": {
          "$ref": "#/$defs/CopyString"
        }
      }
    }
  },
  "$defs": {
    "CopyMeta": {
      "type": "object",
      "description": "Authoring context attached to every copy leaf (D6). Drives auditing, reconciliation, and CI-lintable constraints.",
      "additionalProperties": false,
      "required": ["description", "usage", "register", "audience", "owner", "lastReviewed"],
      "properties": {
        "description": {
          "type": "string",
          "description": "What this string is and why it exists."
        },
        "usage": {
          "type": "array",
          "description": "Every render site / placement where this string appears (file:line or surface name). Makes duplication and placement visible for reconciliation (D11).",
          "items": {
            "type": "string"
          },
          "minItems": 1
        },
        "register": {
          "type": "string",
          "enum": ["atom", "label", "factual", "expressive", "machine", "brand", "consent"],
          "description": "Voice register (see packages/copy/VOICE.md): atom | label | factual | expressive | machine | brand | consent."
        },
        "audience": {
          "type": "string",
          "enum": ["human", "machine", "dual"],
          "description": "Primary audience: human | machine | dual. Drives the human↔AI arbitration rule (machine/dual surfaces stay literal/parseable)."
        },
        "owner": {
          "type": "string",
          "description": "Who owns this string's wording."
        },
        "lastReviewed": {
          "type": "string",
          "format": "date",
          "description": "ISO-8601 date (YYYY-MM-DD) the wording was last deliberately reviewed."
        },
        "constraints": {
          "type": "object",
          "description": "Optional machine-checkable constraints (CI-enforced).",
          "additionalProperties": false,
          "properties": {
            "maxChars": {
              "type": "integer",
              "minimum": 1,
              "description": "Maximum rendered length. CI fails if value exceeds this."
            }
          }
        },
        "rationale": {
          "type": "string",
          "description": "Optional: why this wording/variant exists distinctly (intent, history)."
        }
      }
    },
    "CopyString": {
      "type": "object",
      "description": "A single customer-facing string (ICU MF1 syntax) plus its authoring context.",
      "additionalProperties": false,
      "required": ["value", "_meta"],
      "properties": {
        "value": {
          "type": "string",
          "description": "The string, authored in ICU MessageFormat 1 syntax."
        },
        "_meta": {
          "$ref": "#/$defs/CopyMeta"
        }
      }
    },
    "CopyStringList": {
      "type": "object",
      "description": "An ordered list of customer-facing strings (each ICU MF1) plus shared authoring context.",
      "additionalProperties": false,
      "required": ["value", "_meta"],
      "properties": {
        "value": {
          "type": "array",
          "description": "The strings, each authored in ICU MessageFormat 1 syntax.",
          "items": {
            "type": "string"
          }
        },
        "_meta": {
          "$ref": "#/$defs/CopyMeta"
        }
      }
    },
    "CopyHeading": {
      "type": "object",
      "description": "A section heading, authored as the BARE heading text plus its authoring context. The markdown level affix ('# ', '## ') is a projection owned by the consumer's renderer, not part of the copy — a leaf that ships one is un-rendered again by any consumer that models document structure (atlas decision 0128 P3a). The 'pattern' rejects a leaf that still carries the affix. Flattens to a plain string, so the consumer-facing type is the same as CopyString.",
      "additionalProperties": false,
      "required": ["value", "_meta"],
      "properties": {
        "value": {
          "type": "string",
          "description": "The heading text, authored in ICU MessageFormat 1 syntax. Carries no leading markdown '#' affix and no leading whitespace.",
          "pattern": "^[^#\\s]"
        },
        "_meta": {
          "$ref": "#/$defs/CopyMeta"
        }
      }
    },
    "CopyLink": {
      "type": "object",
      "description": "A link, authored as FIELDS plus its authoring context. The rendered markdown bullet ('- [label](url): notes') is a projection owned by the consumer's renderer, not part of the copy — a leaf that ships one is regex-parsed back into these same three fields by the consumer (atlas decision 0128 P3a). Each 'pattern' rejects a field that still carries an affix. Flattens to an object, hoisted into the derived flat schema's own $defs so every generator names ONE shared type instead of one structural copy per key.",
      "additionalProperties": false,
      "required": ["value", "_meta"],
      "properties": {
        "value": {
          "type": "object",
          "description": "The link's fields. 'label' and 'notes' are authored prose; 'url' is the target.",
          "additionalProperties": false,
          "required": ["label", "url"],
          "properties": {
            "label": {
              "type": "string",
              "description": "The link's visible text, authored in ICU MessageFormat 1 syntax. Carries no list-bullet affix and no markdown link brackets.",
              "pattern": "^(?![-*+]\\s)[^\\[\\]]+$"
            },
            "url": {
              "type": "string",
              "description": "The link target, authored in ICU MessageFormat 1 syntax — a {placeholder} base the consumer substitutes, plus any literal path. Carries no surrounding markdown parentheses and no whitespace.",
              "pattern": "^[^()\\s]+$"
            },
            "notes": {
              "type": "string",
              "description": "Optional prose describing the target. Carries no leading ': ' separator.",
              "pattern": "^[^:\\s]"
            }
          }
        },
        "_meta": {
          "$ref": "#/$defs/CopyMeta"
        }
      }
    }
  }
}
